{
  "workspace": "navlyn.slnx",
  "kind": "solution",
  "command": "resolve-target",
  "selectionInput": {
    "mode": "query",
    "query": "CheckCommand"
  },
  "selectedTarget": {
    "name": "CheckCommand",
    "kind": "NamedType",
    "container": "Navlyn.Cli.Commands",
    "facts": {
      "displayName": "CheckCommand",
      "fullyQualifiedName": "Navlyn.Cli.Commands.CheckCommand",
      "kind": "NamedType",
      "isSource": true,
      "isMetadata": false
    },
    "path": "Navlyn.CommandLine/Cli/Commands/CheckCommand.cs",
    "line": 6,
    "column": 23,
    "endLine": 31,
    "endColumn": 2
  },
  "candidateId": "sym:v1:0123456789abcdef",
  "confidence": "high",
  "candidateCount": 1,
  "totalCandidates": 1,
  "recommendedNextActions": [
    {
      "command": "symbol-source",
      "workspace": "navlyn.slnx",
      "candidateId": "sym:v1:0123456789abcdef",
      "reason": "inspect-selected-source"
    }
  ],
  "warnings": []
}
